{
  "registry_version": "qpds_run_registry_v1.1",
  "workflow_id": "qpds_three_path_live_registry",
  "registry_scope": "shared_runtime_and_lifecycle_runs",
  "registry_note": "Active run registry for live three-path runtime signal and lifecycle executions.",
  "legacy_snapshot_path": "shared/registry/run_registry.legacy_20260413.json",
  "runs": [
    {
      "registry_record_version": "qpds_run_registry_record_v1.0",
      "run_id": "RTRUN-llm-runtime-registration-check-20260413T095208Z-77a538bc",
      "run_number": 1,
      "run_type": "runtime_signal_emitter",
      "workflow_id": "path2_runtime_signal_emitter",
      "path_id": "path_2_access_mode_canonical",
      "status": "success",
      "lifecycle_state": "STATE_3",
      "target_state": "STATE_2",
      "dataset_passport_id": "QPDS-EXAMPLE-001",
      "signal_id": "77a538bc-0792-4790-a801-ec9e63117933",
      "session_id": "llm-runtime-registration-check",
      "routing_decision": "SEND_TO_STATE_2_REVIEW",
      "eligible_for_state_2": true,
      "routing_ids": [
        "QPDS-ROUTE-001"
      ],
      "run_reference_path": "shared/registry/run_references/RTRUN-llm-runtime-registration-check-20260413T095208Z-77a538bc.runtime_signal_run_reference.json",
      "signal_path": "path_2_access_mode_canonical/02_signals/runtime_generated/signal_runtime_20260413T095208Z_77a538bc.json",
      "routing_log_path": "path_2_access_mode_canonical/02_signals/runtime_generated/signal_runtime_20260413T095208Z_77a538bc.routing.json",
      "recorded_at_utc": "2026-04-13T09:52:08Z",
      "inspection_ready": true,
      "frozen_output_queryable": false,
      "model_id": "gpt-oss:20b",
      "model_version": "v10.0-runtime-routing-validation",
      "notes": "Live v1.0 Path 2 runtime signal registration. | Signal remains non-authoritative and enters STATE_3 first.",
      "updated_at_utc": "2026-04-13T09:52:08Z"
    },
    {
      "registry_record_version": "qpds_run_registry_record_v1.0",
      "run_id": "RTRUN-llm-runtime-session-20260418-codex-20260417T204412Z-8d961a1c",
      "run_number": 2,
      "run_type": "runtime_signal_emitter",
      "workflow_id": "path2_runtime_signal_emitter",
      "path_id": "path_2_access_mode_canonical",
      "status": "success",
      "lifecycle_state": "STATE_3",
      "target_state": "STATE_2",
      "dataset_passport_id": "QPDS-EXAMPLE-001",
      "signal_id": "8d961a1c-ecac-4cc0-96f9-310d9e2e8331",
      "session_id": "llm-runtime-session-20260418-codex",
      "routing_decision": "SEND_TO_STATE_2_REVIEW",
      "eligible_for_state_2": true,
      "routing_ids": [
        "QPDS-ROUTE-001"
      ],
      "run_reference_path": "shared/registry/run_references/RTRUN-llm-runtime-session-20260418-codex-20260417T204412Z-8d961a1c.runtime_signal_run_reference.json",
      "signal_path": "path_2_access_mode_canonical/02_signals/runtime_generated/signal_runtime_20260417T204412Z_8d961a1c.json",
      "routing_log_path": "path_2_access_mode_canonical/02_signals/runtime_generated/signal_runtime_20260417T204412Z_8d961a1c.routing.json",
      "recorded_at_utc": "2026-04-17T20:44:12Z",
      "inspection_ready": true,
      "frozen_output_queryable": false,
      "model_id": "gpt-oss:20b",
      "model_version": "v10.0-runtime-routing-validation",
      "notes": "Live v1.0 Path 2 runtime signal registration. | Signal remains non-authoritative and enters STATE_3 first.",
      "updated_at_utc": "2026-04-17T20:44:12Z"
    },
    {
      "registry_record_version": "qpds_run_registry_record_v1.0",
      "run_id": "RTRUN-llm-runtime-session-20260418T034048Z-1e745a07",
      "run_number": 3,
      "run_type": "runtime_signal_emitter",
      "workflow_id": "path2_runtime_signal_emitter",
      "path_id": "path_2_access_mode_canonical",
      "status": "success",
      "lifecycle_state": "STATE_3",
      "target_state": "STATE_2",
      "dataset_passport_id": "QPDS-EXAMPLE-001",
      "signal_id": "1e745a07-d08c-401c-9b4c-465598f8f7d5",
      "session_id": "llm-runtime-session",
      "routing_decision": "SEND_TO_STATE_2_REVIEW",
      "eligible_for_state_2": true,
      "routing_ids": [
        "QPDS-ROUTE-001"
      ],
      "run_reference_path": "shared/registry/run_references/RTRUN-llm-runtime-session-20260418T034048Z-1e745a07.runtime_signal_run_reference.json",
      "signal_path": "path_2_access_mode_canonical/02_signals/runtime_generated/signal_runtime_20260418T034048Z_1e745a07.json",
      "routing_log_path": "path_2_access_mode_canonical/02_signals/runtime_generated/signal_runtime_20260418T034048Z_1e745a07.routing.json",
      "recorded_at_utc": "2026-04-18T03:40:48Z",
      "inspection_ready": true,
      "frozen_output_queryable": false,
      "model_id": "gpt-oss:20b",
      "model_version": "v10.0-runtime-routing-validation",
      "notes": "Live v1.0 Path 2 runtime signal registration. | Signal remains non-authoritative and enters STATE_3 first.",
      "updated_at_utc": "2026-04-18T03:40:48Z"
    },
    {
      "registry_record_version": "qpds_run_registry_record_v1.0",
      "run_id": "RTRUN-llm-runtime-session-20260418T040303Z-8bd67dbc",
      "run_number": 4,
      "run_type": "runtime_signal_emitter",
      "workflow_id": "path2_runtime_signal_emitter",
      "path_id": "path_2_access_mode_canonical",
      "status": "success",
      "lifecycle_state": "STATE_3",
      "target_state": "STATE_2",
      "dataset_passport_id": "QPDS-EXAMPLE-001",
      "signal_id": "8bd67dbc-15ff-4c74-ae92-9b515d0d5002",
      "session_id": "llm-runtime-session",
      "routing_decision": "SEND_TO_STATE_2_REVIEW",
      "eligible_for_state_2": true,
      "routing_ids": [
        "QPDS-ROUTE-001"
      ],
      "run_reference_path": "shared/registry/run_references/RTRUN-llm-runtime-session-20260418T040303Z-8bd67dbc.runtime_signal_run_reference.json",
      "signal_path": "path_2_access_mode_canonical/02_signals/runtime_generated/signal_runtime_20260418T040303Z_8bd67dbc.json",
      "routing_log_path": "path_2_access_mode_canonical/02_signals/runtime_generated/signal_runtime_20260418T040303Z_8bd67dbc.routing.json",
      "recorded_at_utc": "2026-04-18T04:03:03Z",
      "inspection_ready": true,
      "frozen_output_queryable": false,
      "model_id": "gpt-oss:20b",
      "model_version": "v10.0-runtime-routing-validation",
      "notes": "Live v1.0 Path 2 runtime signal registration. | Signal remains non-authoritative and enters STATE_3 first.",
      "updated_at_utc": "2026-04-18T04:03:03Z"
    }
  ],
  "updated_at_utc": "2026-04-18T04:03:03Z"
}
